{"sourceOfTruth":
 {"rootModule": "EvenCycleExample",
  "kind": "compiledLeanEnvironment",
  "descriptor": "EvenCycleExample.WebExport.descriptor"},
 "schemaVersion": "1.1.0",
 "example":
 {"workflows":
  [{"workflowId": "main",
    "title": "Minimum degree three gives an even cycle",
    "stages":
    [{"title": "Endpoint-parity problem",
      "tacticId": null,
      "summary":
      "The graph profile supplies the minimum-degree baseline and even-cycle target used by every downstream stage.",
      "stageId": "main.problem",
      "primaryDeclaration":
      {"type": "(V : Type u) → StructuralExhaustion.Graph.EndpointParityCycle.Profile V",
       "sourceFile": "EvenCycleExample/Problem.lean",
       "selectionRange": {"start": {"line": 23, "column": 7}, "end": {"line": 23, "column": 28}},
       "range": {"start": {"line": 20, "column": 0}, "end": {"line": 25, "column": 47}},
       "name": "EvenCycleExample.endpointParityProfile",
       "module": "EvenCycleExample.Problem",
       "kind": "definition"},
      "kind": "problem",
      "evidenceDeclarations":
      [{"type": "{V : Type u} → StructuralExhaustion.Graph.FiniteObject V → Prop",
        "sourceFile": "EvenCycleExample/Problem.lean",
        "selectionRange": {"start": {"line": 32, "column": 7}, "end": {"line": 32, "column": 15}},
        "range": {"start": {"line": 32, "column": 0}, "end": {"line": 33, "column": 41}},
        "name": "EvenCycleExample.Baseline",
        "module": "EvenCycleExample.Problem",
        "kind": "definition"},
       {"type": "{V : Type u} → StructuralExhaustion.Graph.FiniteObject V → Prop",
        "sourceFile": "EvenCycleExample/Problem.lean",
        "selectionRange": {"start": {"line": 35, "column": 7}, "end": {"line": 35, "column": 19}},
        "range": {"start": {"line": 35, "column": 0}, "end": {"line": 36, "column": 31}},
        "name": "EvenCycleExample.HasEvenCycle",
        "module": "EvenCycleExample.Problem",
        "kind": "definition"}]},
     {"title": "CT6 maximal-path ledger",
      "tacticId": "CT6",
      "summary":
      "CT6 searches the chosen maximal path and returns the active-ledger residual at its endpoint.",
      "stageId": "main.ct6",
      "primaryDeclaration":
      {"type":
       "∀ {V : Type u} (object : StructuralExhaustion.Graph.FiniteObject V) (baseline : Baseline object),\n  StructuralExhaustion.CT6.ActiveLedgerRun (endpointParityProfile V).ct6Spec\n    ((endpointParityProfile V).ct6Capability object) ((endpointParityProfile V).branchContext object baseline)",
       "sourceFile": "EvenCycleExample/CT6Instance.lean",
       "selectionRange": {"start": {"line": 31, "column": 7}, "end": {"line": 31, "column": 13}},
       "range": {"start": {"line": 31, "column": 0}, "end": {"line": 32, "column": 50}},
       "name": "EvenCycleExample.ct6Run",
       "module": "EvenCycleExample.CT6Instance",
       "kind": "definition"},
      "kind": "tactic",
      "evidenceDeclarations":
      [{"type":
        "∀ {V : Type u} (object : StructuralExhaustion.Graph.FiniteObject V) (baseline : Baseline object) (vertex : V),\n  ¬(ct6Spec V).Failure (branchContext object baseline) vertex",
        "sourceFile": "EvenCycleExample/CT6Instance.lean",
        "selectionRange": {"start": {"line": 26, "column": 8}, "end": {"line": 26, "column": 22}},
        "range": {"start": {"line": 26, "column": 0}, "end": {"line": 29, "column": 65}},
        "name": "EvenCycleExample.ct6_no_failure",
        "module": "EvenCycleExample.CT6Instance",
        "kind": "theorem"},
       {"type":
        "∀ {V : Type u} (object : StructuralExhaustion.Graph.FiniteObject V) (baseline : Baseline object) (vertex : V),\n  object.graph.Adj (chosenMaximalPath object baseline).snd.path.endpoint vertex →\n    vertex ∈ (chosenMaximalPath object baseline).snd.path.vertices",
        "sourceFile": "EvenCycleExample/CT6Instance.lean",
        "selectionRange": {"start": {"line": 34, "column": 8}, "end": {"line": 34, "column": 27}},
        "range": {"start": {"line": 34, "column": 0}, "end": {"line": 40, "column": 63}},
        "name": "EvenCycleExample.ct6_endpoint_closed",
        "module": "EvenCycleExample.CT6Instance",
        "kind": "theorem"},
       {"type":
        "ConcreteK4.ct6Execution.terminal = StructuralExhaustion.CT6.Graph.Terminal.activeLedger",
        "sourceFile": "EvenCycleExample/Concrete.lean",
        "selectionRange": {"start": {"line": 66, "column": 8}, "end": {"line": 66, "column": 33}},
        "range": {"start": {"line": 66, "column": 0}, "end": {"line": 68, "column": 48}},
        "name": "EvenCycleExample.ConcreteK4.ct6_terminal_activeLedger",
        "module": "EvenCycleExample.Concrete",
        "kind": "theorem"},
       {"type":
        "StructuralExhaustion.CT6.ExecutionResult.trace (endpointParityProfile ConcreteK4.Vertex).ct6Spec\n    ((endpointParityProfile ConcreteK4.Vertex).ct6Capability ConcreteK4.object)\n    ((endpointParityProfile ConcreteK4.Vertex).branchContext ConcreteK4.object ConcreteK4.minimumDegreeThree)\n    ConcreteK4.ct6Execution =\n  [StructuralExhaustion.CT6.Graph.NodeId.entry, StructuralExhaustion.CT6.Graph.NodeId.firstFailureSearch,\n    StructuralExhaustion.CT6.Graph.NodeId.activeLedgerTerminal]",
        "sourceFile": "EvenCycleExample/Concrete.lean",
        "selectionRange": {"start": {"line": 70, "column": 8}, "end": {"line": 70, "column": 23}},
        "range": {"start": {"line": 70, "column": 0}, "end": {"line": 73, "column": 45}},
        "name": "EvenCycleExample.ConcreteK4.ct6_trace_exact",
        "module": "EvenCycleExample.Concrete",
        "kind": "theorem"}]},
     {"title": "CT9 parity overload",
      "tacticId": "CT9",
      "summary":
      "The registered route converts endpoint-neighbor positions into a capacity-one parity instance for CT9.",
      "stageId": "main.ct9",
      "primaryDeclaration":
      {"type":
       "∀ {V : Type u} (object : StructuralExhaustion.Graph.FiniteObject V) (baseline : Baseline object),\n  StructuralExhaustion.CT9.ParityCapacityOneRun ((endpointParityProfile V).endpointRank object baseline)\n    ((endpointParityProfile V).ct9Input object baseline)",
       "sourceFile": "EvenCycleExample/CT9Instance.lean",
       "selectionRange": {"start": {"line": 42, "column": 7}, "end": {"line": 42, "column": 13}},
       "range": {"start": {"line": 42, "column": 0}, "end": {"line": 43, "column": 50}},
       "name": "EvenCycleExample.ct9Run",
       "module": "EvenCycleExample.CT9Instance",
       "kind": "definition"},
      "kind": "tactic",
      "evidenceDeclarations":
      [{"type":
        "{V : Type u} →\n  (object : StructuralExhaustion.Graph.FiniteObject V) →\n    (baseline : Baseline object) →\n      StructuralExhaustion.Routes.CT6ToCT9.ItemCollectionAdapter\n        (StructuralExhaustion.CT6.ActiveLedgerResidual (endpointParityProfile V).ct6Spec\n          ((endpointParityProfile V).ct6Capability object) ((endpointParityProfile V).branchContext object baseline))\n        ((endpointParityProfile V).ct9Capability object baseline).Item",
        "sourceFile": "EvenCycleExample/CT9Instance.lean",
        "selectionRange": {"start": {"line": 29, "column": 7}, "end": {"line": 29, "column": 26}},
        "range": {"start": {"line": 29, "column": 0}, "end": {"line": 31, "column": 63}},
        "name": "EvenCycleExample.ct6ToCT9ItemAdapter",
        "module": "EvenCycleExample.CT9Instance",
        "kind": "definition"},
       {"type":
        "∀ {V : Type u} (object : StructuralExhaustion.Graph.FiniteObject V) (baseline : Baseline object),\n  3 ≤ (ct9Input object baseline).items.values.length",
        "sourceFile": "EvenCycleExample/CT9Instance.lean",
        "selectionRange": {"start": {"line": 37, "column": 8}, "end": {"line": 37, "column": 37}},
        "range": {"start": {"line": 37, "column": 0}, "end": {"line": 40, "column": 73}},
        "name": "EvenCycleExample.ct9_three_le_item_cardinality",
        "module": "EvenCycleExample.CT9Instance",
        "kind": "theorem"},
       {"type":
        "ConcreteK4.ct9Execution.terminal = StructuralExhaustion.CT9.Graph.Terminal.overloaded",
        "sourceFile": "EvenCycleExample/Concrete.lean",
        "selectionRange": {"start": {"line": 75, "column": 8}, "end": {"line": 75, "column": 31}},
        "range": {"start": {"line": 75, "column": 0}, "end": {"line": 77, "column": 48}},
        "name": "EvenCycleExample.ConcreteK4.ct9_terminal_overloaded",
        "module": "EvenCycleExample.Concrete",
        "kind": "theorem"},
       {"type":
        "StructuralExhaustion.CT9.ExecutionResult.trace\n    (StructuralExhaustion.CT9.parityCapacityOne (endpointParityProfile ConcreteK4.Vertex).base.problem ConcreteK4.Vertex\n      ((endpointParityProfile ConcreteK4.Vertex).endpointRank ConcreteK4.object ConcreteK4.minimumDegreeThree))\n    ((endpointParityProfile ConcreteK4.Vertex).ct9Input ConcreteK4.object ConcreteK4.minimumDegreeThree)\n    ConcreteK4.ct9Execution =\n  [StructuralExhaustion.CT9.Graph.NodeId.entry, StructuralExhaustion.CT9.Graph.NodeId.partition,\n    StructuralExhaustion.CT9.Graph.NodeId.overload, StructuralExhaustion.CT9.Graph.NodeId.overloadedTerminal]",
        "sourceFile": "EvenCycleExample/Concrete.lean",
        "selectionRange": {"start": {"line": 79, "column": 8}, "end": {"line": 79, "column": 23}},
        "range": {"start": {"line": 79, "column": 0}, "end": {"line": 82, "column": 45}},
        "name": "EvenCycleExample.ConcreteK4.ct9_trace_exact",
        "module": "EvenCycleExample.Concrete",
        "kind": "theorem"}]},
     {"title": "Even-cycle certificate",
      "tacticId": null,
      "summary":
      "Equal-parity endpoint positions determine a chord cycle with certified even length.",
      "stageId": "main.certificate",
      "primaryDeclaration":
      {"type":